{
  "schema_version": "data-contract/1.0.0",
  "data_version": "synthetic-base/1.0.0",
  "fixture_id": "FIXTURE-HISTORICAL-FLOW",
  "record_id_template": "FLOW-{YYYYMMDD}-{CATEGORY_ID}",
  "week_starts": [
    "2026-04-13", "2026-04-20", "2026-04-27", "2026-05-04",
    "2026-05-11", "2026-05-18", "2026-05-25", "2026-06-01",
    "2026-06-08", "2026-06-15", "2026-06-22", "2026-06-29",
    "2026-07-06", "2026-07-13", "2026-07-20", "2026-07-27"
  ],
  "provenance": {
    "mode": "SYNTHETIC",
    "created_by": "NourishOps build-context team",
    "description": "Ninety-six deterministic category-week observations encoded as six parallel time series."
  },
  "series": [
    {
      "category_id": "PROTEIN",
      "warehouse_id": "WH-CENTRAL-01",
      "beginning_inventory_lb": [30000,30000,30000,30000,30000,30000,30000,30000,30000,30000,30000,30000,30000,30000,30000,30000],
      "donated_inbound_lb": [2000,2000,2500,2000,2000,2000,2500,2000,2000,2000,2500,2000,2000,2000,2500,2000],
      "usda_inbound_lb": [4000,4500,4500,4500,4000,4500,4500,4500,4000,4500,4500,4500,4000,4500,4500,4500],
      "purchased_inbound_lb": [2000,2000,2000,2000,2000,2000,2000,2000,2000,2000,2000,2000,2000,2000,2000,2000],
      "transfer_inbound_lb": [500,500,500,500,500,500,500,500,500,500,500,500,500,500,500,500],
      "distributed_lb": [8500,9000,9500,9000,8500,9000,9500,9000,8500,9000,9500,9000,8500,9000,9500,9000],
      "spoilage_lb": [0,0,0,0,0,0,0,0,0,0,0,0,0,0,0,0],
      "unmet_distribution_lb": [0,0,0,0,0,0,0,0,0,0,0,0,0,0,0,0],
      "ending_inventory_lb": [30000,30000,30000,30000,30000,30000,30000,30000,30000,30000,30000,30000,30000,30000,30000,30000],
      "record_version": 1,
      "provenance_id": "PROV-SYNTHETIC-HISTORY"
    },
    {
      "category_id": "PRODUCE",
      "warehouse_id": "WH-CENTRAL-01",
      "beginning_inventory_lb": [15000,15000,15000,15000,15000,15000,15000,15000,15000,15000,15000,15000,15000,15000,15000,15000],
      "donated_inbound_lb": [10000,10500,11500,10500,10000,10500,11500,10500,10000,10500,11500,10500,10000,10500,11500,10500],
      "usda_inbound_lb": [2000,2500,2500,2500,2000,2500,2500,2500,2000,2500,2500,2500,2000,2500,2500,2500],
      "purchased_inbound_lb": [1000,1000,1000,1000,1000,1000,1000,1000,1000,1000,1000,1000,1000,1000,1000,1000],
      "transfer_inbound_lb": [500,500,500,500,500,500,500,500,500,500,500,500,500,500,500,500],
      "distributed_lb": [13000,14000,15000,14000,13000,14000,15000,14000,13000,14000,15000,14000,13000,14000,15000,14000],
      "spoilage_lb": [500,500,500,500,500,500,500,500,500,500,500,500,500,500,500,500],
      "unmet_distribution_lb": [0,0,0,0,0,0,0,0,0,0,0,0,0,0,0,0],
      "ending_inventory_lb": [15000,15000,15000,15000,15000,15000,15000,15000,15000,15000,15000,15000,15000,15000,15000,15000],
      "record_version": 1,
      "provenance_id": "PROV-SYNTHETIC-HISTORY"
    },
    {
      "category_id": "DAIRY",
      "warehouse_id": "WH-CENTRAL-01",
      "beginning_inventory_lb": [9000,9000,9000,9000,9000,9000,9000,9000,9000,9000,9000,9000,9000,9000,9000,9000],
      "donated_inbound_lb": [1500,1500,2000,1500,1500,1500,2000,1500,1500,1500,2000,1500,1500,1500,2000,1500],
      "usda_inbound_lb": [2000,2500,2500,2500,2000,2500,2500,2500,2000,2500,2500,2500,2000,2500,2500,2500],
      "purchased_inbound_lb": [1500,1500,1500,1500,1500,1500,1500,1500,1500,1500,1500,1500,1500,1500,1500,1500],
      "transfer_inbound_lb": [500,500,500,500,500,500,500,500,500,500,500,500,500,500,500,500],
      "distributed_lb": [5500,6000,6500,6000,5500,6000,6500,6000,5500,6000,6500,6000,5500,6000,6500,6000],
      "spoilage_lb": [0,0,0,0,0,0,0,0,0,0,0,0,0,0,0,0],
      "unmet_distribution_lb": [0,0,0,0,0,0,0,0,0,0,0,0,0,0,0,0],
      "ending_inventory_lb": [9000,9000,9000,9000,9000,9000,9000,9000,9000,9000,9000,9000,9000,9000,9000,9000],
      "record_version": 1,
      "provenance_id": "PROV-SYNTHETIC-HISTORY"
    },
    {
      "category_id": "GRAINS",
      "warehouse_id": "WH-CENTRAL-01",
      "beginning_inventory_lb": [45000,45000,45000,45000,45000,45000,45000,45000,45000,45000,45000,45000,45000,45000,45000,45000],
      "donated_inbound_lb": [1500,2000,2000,2000,1500,2000,2000,2000,1500,2000,2000,2000,1500,2000,2000,2000],
      "usda_inbound_lb": [4000,4000,4500,4000,4000,4000,4500,4000,4000,4000,4500,4000,4000,4000,4500,4000],
      "purchased_inbound_lb": [3500,3500,3500,3500,3500,3500,3500,3500,3500,3500,3500,3500,3500,3500,3500,3500],
      "transfer_inbound_lb": [500,500,500,500,500,500,500,500,500,500,500,500,500,500,500,500],
      "distributed_lb": [9500,10000,10500,10000,9500,10000,10500,10000,9500,10000,10500,10000,9500,10000,10500,10000],
      "spoilage_lb": [0,0,0,0,0,0,0,0,0,0,0,0,0,0,0,0],
      "unmet_distribution_lb": [0,0,0,0,0,0,0,0,0,0,0,0,0,0,0,0],
      "ending_inventory_lb": [45000,45000,45000,45000,45000,45000,45000,45000,45000,45000,45000,45000,45000,45000,45000,45000],
      "record_version": 1,
      "provenance_id": "PROV-SYNTHETIC-HISTORY"
    },
    {
      "category_id": "STAPLES_MIXED_MEALS",
      "warehouse_id": "WH-CENTRAL-01",
      "beginning_inventory_lb": [40000,40000,40000,40000,40000,40000,40000,40000,40000,40000,40000,40000,40000,40000,40000,40000],
      "donated_inbound_lb": [2500,2500,3000,2500,2500,2500,3000,2500,2500,2500,3000,2500,2500,2500,3000,2500],
      "usda_inbound_lb": [2500,3000,3000,3000,2500,3000,3000,3000,2500,3000,3000,3000,2500,3000,3000,3000],
      "purchased_inbound_lb": [3000,3000,3000,3000,3000,3000,3000,3000,3000,3000,3000,3000,3000,3000,3000,3000],
      "transfer_inbound_lb": [500,500,500,500,500,500,500,500,500,500,500,500,500,500,500,500],
      "distributed_lb": [8500,9000,9500,9000,8500,9000,9500,9000,8500,9000,9500,9000,8500,9000,9500,9000],
      "spoilage_lb": [0,0,0,0,0,0,0,0,0,0,0,0,0,0,0,0],
      "unmet_distribution_lb": [0,0,0,0,0,0,0,0,0,0,0,0,0,0,0,0],
      "ending_inventory_lb": [40000,40000,40000,40000,40000,40000,40000,40000,40000,40000,40000,40000,40000,40000,40000,40000],
      "record_version": 1,
      "provenance_id": "PROV-SYNTHETIC-HISTORY"
    },
    {
      "category_id": "SNACKS_DISCRETIONARY",
      "warehouse_id": "WH-CENTRAL-01",
      "beginning_inventory_lb": [30000,30000,30000,30000,30000,30000,30000,30000,30000,30000,30000,30000,30000,30000,30000,30000],
      "donated_inbound_lb": [3000,3500,4000,3500,3000,3500,4000,3500,3000,3500,4000,3500,3000,3500,4000,3500],
      "usda_inbound_lb": [0,0,0,0,0,0,0,0,0,0,0,0,0,0,0,0],
      "purchased_inbound_lb": [500,500,500,500,500,500,500,500,500,500,500,500,500,500,500,500],
      "transfer_inbound_lb": [0,0,0,0,0,0,0,0,0,0,0,0,0,0,0,0],
      "distributed_lb": [3500,4000,4500,4000,3500,4000,4500,4000,3500,4000,4500,4000,3500,4000,4500,4000],
      "spoilage_lb": [0,0,0,0,0,0,0,0,0,0,0,0,0,0,0,0],
      "unmet_distribution_lb": [0,0,0,0,0,0,0,0,0,0,0,0,0,0,0,0],
      "ending_inventory_lb": [30000,30000,30000,30000,30000,30000,30000,30000,30000,30000,30000,30000,30000,30000,30000,30000],
      "record_version": 1,
      "provenance_id": "PROV-SYNTHETIC-HISTORY"
    }
  ]
}
